{
  "schema": "euclid-min-regular-257-dependency-report/v1",
  "source": {
    "certificate": "construction-69e.json",
    "certificate_sha256": "9b47738d955099547e15369f35cde40fa52c8c5d7594294d372f1ad753c6b10b",
    "construction_sha256": "6c4b0113fae6ab513d3a1564a268415fa1dd96952e14753201880b776f6fe3d3",
    "verification_report": "verification-69e.json"
  },
  "semantics": {
    "edge_direction": "dependency_to_consumer",
    "scope": "declared_certificate_bindings",
    "limitation": "只证明证书声明的依赖关系；未搜索同一交点的其他对象对，也不证明付费步骤在所有几何构造中不可替代。"
  },
  "summary": {
    "initial_nodes": 3,
    "program_nodes": 150,
    "paid_nodes": 69,
    "line_nodes": 65,
    "circle_nodes": 4,
    "intersection_nodes": 81,
    "edges": 300,
    "syntactically_dead_paid_nodes": 0
  },
  "nodes": [
    {
      "id": "C",
      "kind": "initial_point",
      "program_index": 0,
      "e_move": 0,
      "paid": false,
      "dependencies": []
    },
    {
      "id": "B",
      "kind": "initial_point",
      "program_index": 0,
      "e_move": 0,
      "paid": false,
      "dependencies": []
    },
    {
      "id": "c0",
      "kind": "initial_circle",
      "program_index": 0,
      "e_move": 0,
      "paid": false,
      "dependencies": []
    },
    {
      "id": "a",
      "kind": "line",
      "program_index": 1,
      "e_move": 1,
      "paid": true,
      "dependencies": [
        "C",
        "B"
      ]
    },
    {
      "id": "M1",
      "kind": "intersection",
      "program_index": 2,
      "e_move": 1,
      "paid": false,
      "dependencies": [
        "a",
        "c0"
      ]
    },
    {
      "id": "q",
      "kind": "circle",
      "program_index": 3,
      "e_move": 2,
      "paid": true,
      "dependencies": [
        "B",
        "C"
      ]
    },
    {
      "id": "q_c0_left",
      "kind": "intersection",
      "program_index": 4,
      "e_move": 2,
      "paid": false,
      "dependencies": [
        "q",
        "c0"
      ]
    },
    {
      "id": "q_c0_right",
      "kind": "intersection",
      "program_index": 5,
      "e_move": 2,
      "paid": false,
      "dependencies": [
        "q",
        "c0"
      ]
    },
    {
      "id": "d",
      "kind": "line",
      "program_index": 6,
      "e_move": 3,
      "paid": true,
      "dependencies": [
        "q_c0_left",
        "q_c0_right"
      ]
    },
    {
      "id": "A",
      "kind": "intersection",
      "program_index": 7,
      "e_move": 3,
      "paid": false,
      "dependencies": [
        "a",
        "d"
      ]
    },
    {
      "id": "c",
      "kind": "circle",
      "program_index": 8,
      "e_move": 4,
      "paid": true,
      "dependencies": [
        "A",
        "B"
      ]
    },
    {
      "id": "D",
      "kind": "intersection",
      "program_index": 9,
      "e_move": 4,
      "paid": false,
      "dependencies": [
        "c",
        "d"
      ]
    },
    {
      "id": "E",
      "kind": "intersection",
      "program_index": 10,
      "e_move": 4,
      "paid": false,
      "dependencies": [
        "c",
        "d"
      ]
    },
    {
      "id": "BE",
      "kind": "line",
      "program_index": 11,
      "e_move": 5,
      "paid": true,
      "dependencies": [
        "B",
        "E"
      ]
    },
    {
      "id": "G",
      "kind": "intersection",
      "program_index": 12,
      "e_move": 5,
      "paid": false,
      "dependencies": [
        "BE",
        "c0"
      ]
    },
    {
      "id": "b",
      "kind": "line",
      "program_index": 13,
      "e_move": 6,
      "paid": true,
      "dependencies": [
        "C",
        "G"
      ]
    },
    {
      "id": "F",
      "kind": "intersection",
      "program_index": 14,
      "e_move": 6,
      "paid": false,
      "dependencies": [
        "b",
        "c0"
      ]
    },
    {
      "id": "DM1",
      "kind": "line",
      "program_index": 15,
      "e_move": 7,
      "paid": true,
      "dependencies": [
        "D",
        "M1"
      ]
    },
    {
      "id": "H",
      "kind": "intersection",
      "program_index": 16,
      "e_move": 7,
      "paid": false,
      "dependencies": [
        "DM1",
        "c"
      ]
    },
    {
      "id": "I",
      "kind": "intersection",
      "program_index": 17,
      "e_move": 7,
      "paid": false,
      "dependencies": [
        "DM1",
        "b"
      ]
    },
    {
      "id": "IE",
      "kind": "line",
      "program_index": 18,
      "e_move": 8,
      "paid": true,
      "dependencies": [
        "I",
        "E"
      ]
    },
    {
      "id": "K",
      "kind": "intersection",
      "program_index": 19,
      "e_move": 8,
      "paid": false,
      "dependencies": [
        "IE",
        "c"
      ]
    },
    {
      "id": "J",
      "kind": "intersection",
      "program_index": 20,
      "e_move": 8,
      "paid": false,
      "dependencies": [
        "IE",
        "a"
      ]
    },
    {
      "id": "DJ",
      "kind": "line",
      "program_index": 21,
      "e_move": 9,
      "paid": true,
      "dependencies": [
        "D",
        "J"
      ]
    },
    {
      "id": "L",
      "kind": "intersection",
      "program_index": 22,
      "e_move": 9,
      "paid": false,
      "dependencies": [
        "DJ",
        "c"
      ]
    },
    {
      "id": "KL",
      "kind": "line",
      "program_index": 23,
      "e_move": 10,
      "paid": true,
      "dependencies": [
        "K",
        "L"
      ]
    },
    {
      "id": "N",
      "kind": "intersection",
      "program_index": 24,
      "e_move": 10,
      "paid": false,
      "dependencies": [
        "KL",
        "BE"
      ]
    },
    {
      "id": "M",
      "kind": "intersection",
      "program_index": 25,
      "e_move": 10,
      "paid": false,
      "dependencies": [
        "KL",
        "a"
      ]
    },
    {
      "id": "NI",
      "kind": "line",
      "program_index": 26,
      "e_move": 11,
      "paid": true,
      "dependencies": [
        "N",
        "I"
      ]
    },
    {
      "id": "O",
      "kind": "intersection",
      "program_index": 27,
      "e_move": 11,
      "paid": false,
      "dependencies": [
        "NI",
        "a"
      ]
    },
    {
      "id": "FO",
      "kind": "line",
      "program_index": 28,
      "e_move": 12,
      "paid": true,
      "dependencies": [
        "F",
        "O"
      ]
    },
    {
      "id": "A0",
      "kind": "intersection",
      "program_index": 29,
      "e_move": 12,
      "paid": false,
      "dependencies": [
        "FO",
        "c"
      ]
    },
    {
      "id": "A1",
      "kind": "intersection",
      "program_index": 30,
      "e_move": 12,
      "paid": false,
      "dependencies": [
        "FO",
        "c"
      ]
    },
    {
      "id": "BA0",
      "kind": "line",
      "program_index": 31,
      "e_move": 13,
      "paid": true,
      "dependencies": [
        "B",
        "A0"
      ]
    },
    {
      "id": "R",
      "kind": "intersection",
      "program_index": 32,
      "e_move": 13,
      "paid": false,
      "dependencies": [
        "BA0",
        "b"
      ]
    },
    {
      "id": "BA1",
      "kind": "line",
      "program_index": 33,
      "e_move": 14,
      "paid": true,
      "dependencies": [
        "B",
        "A1"
      ]
    },
    {
      "id": "S",
      "kind": "intersection",
      "program_index": 34,
      "e_move": 14,
      "paid": false,
      "dependencies": [
        "BA1",
        "b"
      ]
    },
    {
      "id": "RM",
      "kind": "line",
      "program_index": 35,
      "e_move": 15,
      "paid": true,
      "dependencies": [
        "R",
        "M"
      ]
    },
    {
      "id": "B0",
      "kind": "intersection",
      "program_index": 36,
      "e_move": 15,
      "paid": false,
      "dependencies": [
        "RM",
        "c"
      ]
    },
    {
      "id": "B2",
      "kind": "intersection",
      "program_index": 37,
      "e_move": 15,
      "paid": false,
      "dependencies": [
        "RM",
        "c"
      ]
    },
    {
      "id": "SM",
      "kind": "line",
      "program_index": 38,
      "e_move": 16,
      "paid": true,
      "dependencies": [
        "S",
        "M"
      ]
    },
    {
      "id": "B1",
      "kind": "intersection",
      "program_index": 39,
      "e_move": 16,
      "paid": false,
      "dependencies": [
        "SM",
        "c"
      ]
    },
    {
      "id": "B3",
      "kind": "intersection",
      "program_index": 40,
      "e_move": 16,
      "paid": false,
      "dependencies": [
        "SM",
        "c"
      ]
    },
    {
      "id": "EA1",
      "kind": "line",
      "program_index": 41,
      "e_move": 17,
      "paid": true,
      "dependencies": [
        "E",
        "A1"
      ]
    },
    {
      "id": "T",
      "kind": "intersection",
      "program_index": 42,
      "e_move": 17,
      "paid": false,
      "dependencies": [
        "EA1",
        "a"
      ]
    },
    {
      "id": "LB0",
      "kind": "line",
      "program_index": 43,
      "e_move": 18,
      "paid": true,
      "dependencies": [
        "L",
        "B0"
      ]
    },
    {
      "id": "U",
      "kind": "intersection",
      "program_index": 44,
      "e_move": 18,
      "paid": false,
      "dependencies": [
        "LB0",
        "b"
      ]
    },
    {
      "id": "UT",
      "kind": "line",
      "program_index": 45,
      "e_move": 19,
      "paid": true,
      "dependencies": [
        "U",
        "T"
      ]
    },
    {
      "id": "Ca",
      "kind": "intersection",
      "program_index": 46,
      "e_move": 19,
      "paid": false,
      "dependencies": [
        "UT",
        "c"
      ]
    },
    {
      "id": "EA0",
      "kind": "line",
      "program_index": 47,
      "e_move": 20,
      "paid": true,
      "dependencies": [
        "E",
        "A0"
      ]
    },
    {
      "id": "V",
      "kind": "intersection",
      "program_index": 48,
      "e_move": 20,
      "paid": false,
      "dependencies": [
        "EA0",